{
  "schemaVersion": "1.0",
  "kind": "teacher-feedback-submission",
  "submissionId": "synthetic-teacher-format-low",
  "sampleId": "synthetic-linear-equation",
  "subjectPack": "math-answer",
  "sourceRunRef": "../synthetic-readiness/generated-format-omission.sample-run-record.json",
  "sourceRunSha256": "d19f8766895cdeaa13408756156edba723c6dd4b28aaaa27dbe9dc0c4a62a1b9",
  "fixtureKind": "synthetic_fixture",
  "dataClassification": {
    "level": "public",
    "notes": "repository-owned synthetic teacher feedback"
  },
  "text": "排版存在格式错误，低严重度。",
  "reporter": "synthetic_teacher_fixture",
  "createdAt": "2026-07-26T13:01:00.000Z"
}
