{
  "schemaVersion": "1.0",
  "kind": "teacher-feedback-submission",
  "submissionId": "synthetic-teacher-reasoning-medium",
  "sampleId": "synthetic-linear-equation",
  "subjectPack": "math-answer",
  "sourceRunRef": "../synthetic-readiness/generated-arithmetic-slip.sample-run-record.json",
  "sourceRunSha256": "ba5b6fe543624d8c40fe8ac7fa3788a2c73dfbb39bbf1bb75e04e5811140f9ec",
  "fixtureKind": "synthetic_fixture",
  "dataClassification": {
    "level": "public",
    "notes": "repository-owned synthetic teacher feedback"
  },
  "text": "这份答案有明确的推理错误，中严重度。",
  "reporter": "synthetic_teacher_fixture",
  "createdAt": "2026-07-26T13:00:00.000Z"
}
